2024-05-23 05:18:00,2024-05-23 05:56:26,IP Address,100,2306,True,2024-05-23 05:56:27,R_6DoV1ojkv54WaW0,email,EN,May,23,2024,Venison for Vermonters,Rutland,Vermont,USA,05701,Yes,Vermont Department of Fish and Wildlife (Vermont Warden Service),"Wild game meat donation program,Natural resource state agency","The Venison for Vermonters program is run by game wardens within the Vermont Department of Fish and Wildlife. It is a program that focuses primarily on salvaging roadkill deer, moose and bear which are then processed and given to Food Shelves, individuals, and outreach programs across the state. The program also accepts hunter donations of whole large game.",No,,,,,,2020,4,,July,2022,June,2023,,1075.6,Actual,0,0,0,0,0,0,0,0,0,0,0,0,0,Actual,Actual,Actual,Actual,Actual,Actual,Actual,Actual,Actual,Actual,Actual,Actual,Actual,"We no longer keep track of species specific donation information because it was proving to be too labor intensive. However, on average I would estimate that 70% of the meat donated is white-tailed deer, approximately 25% moose, and approximately 5% bear. Again, these are simply estimates since we no longer track species information for donations.  Depending on the year and which wardens are participating in the program, moose can make up a larger or smaller percentage of donations. For instance, in 2020-2021, the program produced over 3,000lbs of meat, and about two thirds of that was moose meat. Much of the moose meat has come from the Northeastern part of Vermont where moose are more abundant. In recent years, we have had less moose meat because the butcher who used to process meat in northeastern Vermont retired from the business and we are no longer able to use him as a processor in that region. That said, our program only process meat from moose, deer, and bear, and we rely mostly on white tailed deer.",15,62,Estimated,Estimated,State,,,,,10,10,2,2,,"Most of our meat comes from salvageable roadkills, so hunter participation was not an issue. Vermont does not require USDA inspection for wild game. The Vermont Food Bank will not accept donations of non-inspected meat. However, there are countless food shelves throughout the state who do not have those restrictions and who are grateful for our wild game donations.",,,Yes,"Food shelves through the state are always eager to receive meat donations. If we had more meat to give, they would gladly take it. Quality protein is always hard to come by for local food shelves. ",10,,5,5,8,5,"The last category ""other"" refers to warden participation since our program relies almost exclusively on roadkill donated by Vermont state game wardens. Most of the meat processing is also conducted by VT game wardens.",2,10,Estimated,Estimated,"These are just estimates. ",,We do not yet list that info on our website. Our program is still small and we do not have an established network of processors or adequate funding to pay processors.,,,,,,Actual,Estimated,Actual,Estimated,Actual,"The program is run entirely by Vermont game wardens (mainly one warden). In the past we have also had a wild game processor who is paid by the job. However, that processor closed up shop, and our Dpt has not had the funds to pay another processor. For this reason, nearly all meat currently being processed for the program is being processed by a single game warden. This warden (in addition to her other duties as a game warden) collects wild game from salvageable roadkills, processes the game, and distributes to food shelves. Her work hours relating to this program is unknown. ",,,0,0,0,0,0,0,,,,,,,"There is currently no real funding source for the Venison for Vermonters program. On duty game wardens are solely responsible for the program and its survival in addition to their other duties. ",Yes,"802 793 1270
Abigail.serra@vermont.gov",Yes,,,
2024-05-23 06:06:38,2024-05-23 06:34:38,IP Address,100,1680,True,2024-05-23 06:34:39,R_6TnGPbAeMXBrhYW,email,EN,May,23,2024,HI,Highland County FHFH,Ohio,Highland,45133,No,,Wild game meat donation program,,Yes,,,National,Yes,"Handle money and helps with grant application ",2009,15,,September,2023,February,2024,,$2940,Actual,2940,0,0,0,0,0,0,0,0,0,0,0,0,Actual,Actual,Actual,Actual,Actual,Actual,Actual,Actual,Actual,Actual,Actual,Actual,Actual,,40,40,Estimated,Estimated,Multiple counties,,2,2,2,9,1,1,5,,,No,,Yes,,10,1,1,1,1,,,1,7,Actual,Actual,,No,,1,,0,0,0,Actual,Estimated,Actual,Estimated,Actual,Obe coordinator no pay,"$3,000",Actual,,0,"NRA Hunter for the Hungry $2,000",0,"Ohio Division of WL $2,000",0,Actual,,Actual,,Actual,Percentage,,Yes,,No,,,"Very needed and helps use wl meat control deer population and help hungry people "
2024-05-21 21:13:46,2024-05-23 06:56:45,IP Address,100,121379,True,2024-05-23 06:56:46,R_1gRvEUS7WvPOW4A,email,EN,May,21,2024,FHFH,"Gainesville ",GA,United States,30506,No,,Wild game meat donation program,,No,,,,,,My chapter of FHFH started in 2007,17 years,"Nationally, FHFH started 27 years ago",September,2023,January,2024,,447.50,Actual,447.5,0,0,0,0,0,0,0,0,0,0,0,0,Actual,Actual,Actual,Actual,Actual,Actual,Actual,Actual,Actual,Actual,Actual,Actual,Actual,,30,100,Estimated,Estimated,Multiple counties,,,,5,4,1,2,4,,,No,,No,Not at this time. A new contact just took over the program from the old processor. He purchased the company from him.,,,,,,,,1,1,Actual,Actual,,Yes,,2,40,0,0,0,Actual,Estimated,Actual,Actual,Actual,,500.00,Actual,0,500,0,0,0,0,,Actual,,,,,Received $500 NRA grant this past season,Yes,,Yes,,"Hunters Feeding the Hungry (Georgia Wildlife Federation)
","Suggestion: There should be a coordinated effort to include all of Georgia's ""vetted"" venison donation programs."
2024-05-24 02:09:38,2024-05-24 02:57:56,IP Address,100,2897,True,2024-05-24 02:57:57,R_1wLk2jmA65UaGAG,email,EN,May,24,2024,Farmers and Hunters feeding the hungry,Donalds,"South Carolina ",USA,29638,No,,Wild game meat donation program,,Yes,,Farmers and Hunters feeding the hungry,National,Yes,"Provides the non-profit status and structurally supports all aspects organizationally and operationally ",2021,3,,October,2023,January,2024,"Deer season South Carolina ",650 pounds,Actual,650,0,0,0,0,0,0,0,0,0,0,0,0,Actual,Actual,Actual,Actual,Actual,Actual,Actual,Actual,Actual,Actual,Actual,Actual,Actual,,"20 miles ",40,Estimated,Estimated,County,,,,,,,,,,Donors were making partial donations verses whole deer donations. Adjusted butcher compensation verses whole deer fixed rate,No,,Yes,"The recipient (children’s home) would be able to receive more donation than we provide. Increased donations of deer meat would be welcomed by recipient. ",5,5,,,,,"The potential or possibilities are difficult to estimate. Word of mouth is primary marketing. The butcher shop has the greatest outreach to potential donors simply from visibility of our posters at their business location.
",1,1,Actual,Actual,,,,3,50,0,0,0,Actual,Estimated,Actual,Actual,Actual,,2000/yr,Estimated,2000,0,0,0,0,0,Actual,Actual,Actual,Actual,Actual,Actual,,Yes,925-588-4751,Yes,"Acknowledge to organization of FHFH which I represent as a coordinator in Abbeville County of South Carolina ",,
2024-05-24 07:54:44,2024-05-24 08:25:22,IP Address,100,1837,True,2024-05-24 08:25:23,R_5fqo1umF5xkYak6,email,EN,May,21,2024,Forest Feeding Families,Naperville,Illinois,United States,60565,No,,Wild game meat donation program,We also work to continue education around conservation and wildlife management and the role hunters play.,No,,,,,,2019,4,,March,2023,March,2024,We operate on Calendar Year for tax purposes but we use March to March for venison donations,2800,Estimated,2800,0,0,0,0,0,0,0,0,0,0,0,0,Actual,Actual,Actual,Actual,Actual,Actual,Actual,Actual,Actual,Actual,Actual,Actual,Actual,We approximate the total lbs but its pretty accurate.,100,400,Estimated,Estimated,Regional,We donate locally. We do take donations regionally.  We want to expand our donation efforts to align with where we get donations from to reduce the logistics and travel,,,9,7,3,5,2,,"Hunter participation is the #1 factor for success.  We accept deer from any licensed processor that a hunter would drop it off.  We will subsidize the cost and even pick it up. So, logistics can get difficult, and donations are very important.",No,We have in the past but not this year,Yes,"There is certainly interest.  We need to get more hunters to donate.  Every time to discuss with hunters that seem very interested, we just need to stay present and remind them of our service.  The non hunting community has been very positive on it as well, which has been a good sign.  We also realize we need more pantries to donate to as well if we keep growing. ",9,10,,7,,,,5,2,Estimated,Actual,We need to add another pantry.  Our model allows us to normally use any licensed deer processor.  We have found that focusing on deer processors to drive donations has not lead to success. They are too busy and have low margins. We have offered to pay them full price if they would just ask hunters to donate and hasn't drove any growth,Yes,We have processors that are in our local area. We do list on our news and updates other processors we have used.,9,100*,0,0,0,Actual,Estimated,Actual,Actual,Actual,We don't have any paid employees. All volunteer.  *I have no idea how many hours total. The 100 is a complete guess.,"7,000",Estimated,7000,0,0,0,0,0,Estimated,,,,,,We only have private donations,Yes,,Yes,"We lease land in SW Michigan as part of our organization that we donate as part of our program. We would love to recruit more hunters ",,
2024-05-24 16:18:59,2024-05-24 16:32:58,IP Address,100,838,True,2024-05-24 16:32:59,R_5fpWcOX5Kx3VnKB,email,EN,May,24,2024,Farmers and Hunters Feeding the Hungry,Sunbury,OH,United States,43074,Yes,"Farmers and Hunter Feeding the Hungry ",Wild game meat donation program,"Our main source of donation is venison, however, we also take beef and domestic hogs too. ",No,,,,,,2007,75-100 deer/year,,July,2023,June,2024,,"4,000 lbs.",Estimated,"4,000 lbs.",0,0,0,0,0,0,0,0,0,0,0,0,Estimated,Actual,Actual,Actual,Actual,Actual,Actual,Actual,Actual,Actual,Actual,Actual,Actual,,15 miles,30 miles,Estimated,Estimated,Multiple counties,,,,,2,8,,3,,,Yes,Grant from Ohio Division of Wildlife,Yes,,1,0,3,,9,,,1,-0,Actual,Estimated,,Yes,,1,75,0,0,,Actual,Estimated,Actual,Estimated,Actual,,,,0,0,0,0,0,0,,,,,,,"State grant, grants from non profit conservation organizations, and some local cash donations",Yes,,Yes,Delaware County (OH) FHFH,,
2024-05-26 12:21:18,2024-05-26 12:46:29,IP Address,100,1510,True,2024-05-26 12:46:30,R_6I3GJYd0QCUe7EI,email,EN,May,26,2024,Kentucky Hunters for the Hungry INC,"Louisville ","Kentucky ",USA,40253,No,,Wild game meat donation program,,No,,,,,,2000,24,"Incorporated in 2000, started in 1988",March,2023,February,2024,,"116,764",Actual,"116,764",0,0,0,0,0,0,0,0,0,0,0,0,Actual,Actual,Actual,Actual,Actual,Actual,Actual,Actual,Actual,Actual,Actual,Actual,Actual,,,129,Estimated,Estimated,State,"Hard to quantify as local food banks and charities pick the meat up from our processors ",5,,8,10,4,6,9,,,Yes,,Yes,Constant demand for more protein across the State,10,8,10,6,7,,,65,136,Actual,Estimated,,,We do not list,17,No idea not trackec,0,0,N/A,Actual,Estimated,Actual,Actual,Actual,No paid staff,"388,878",Actual,"45,000","125,000",0,"50,000","170,000",0,Estimated,Estimated,,,Actual,,,Yes,Email rdlapointe@yahoo.com,Yes,,No,
2024-05-29 08:10:02,2024-05-29 09:16:15,IP Address,100,3972,True,2024-05-29 09:16:16,R_1hZ6JsX5i6cImby,email,EN,May,29,2024,Meat donation program? I don't think we have a specific name,,Utah,,,No,,Wild game meat donation program,,No,The Utah Division of Wildlife Resources has a list where individuals can sign up to receive donated meat. At times we will donate to food banks and ask NGO's to help pay for processing costs.,,,,,,,"I am unsure where to find this information. I am sure we have had a meat donation list for 30 plus years. Our donations come from illegal harvest or Division removal efforts. ",January,2023,December,2023,,743,Estimated,0,176,3,281,7,0,7,0,0,2,0,0,307,Actual,Estimated,Estimated,Estimated,Estimated,Actual,Estimated,Actual,Actual,Estimated,Actual,Actual,Estimated,"A lot of our animals are donated unprocessed and not weighed. My weight entries are the number of animals donated. The other is 293 fish including trout, salmon, bass, sunfish, and catfish. 14 birds including swan, geese, ducks, and pheasants. These numbers are probably close to accurate and do signify a minimum",50,150,Estimated,Estimated,State,This is a very difficult question to answer. At times individuals will be in the field when the meat is donated. Other times they meet at a regional office or other location. I wouldn't think we travel more than 150 miles to donate. Those answers are very much a guess.,,,1,7,1,4,2,,,No,We are the state agency.,No,We are set up pretty good to handle our needs as we have been doing for a long time.,,,,,,,,3,10,Estimated,Estimated,Many of the donated animals are not processed. If they are a lot of times the animal was seized by law enforcement. At times when we do division removals we will have meat processors help. We do donate these to food banks.,No,We do not list any on our website.,,,50,10,800,Actual,Estimated,Estimated,Estimated,Estimated,We do not have a dedicated person or persons. This is a very rough estimate as it can be part of a lot of different peoples job.,,Estimated,0,0,"25,000",0,"30,000",0,Actual,Actual,Estimated,Actual,Estimated,,,Yes,"Utah Division of Wildlife Resources
Chad Wilson 
801 391-1234",Yes,You can acknowledge the Utah Division of Wildlife Resources. Please do not list names of people or phone numbers,,"Generally our program is largely seized animals by law enforcement, road kill, and agency removal. This last year we had a large Division removal effort on elk, which inflated the elk donaion numbers. Generally we do not donate to that many food pantries or spend that much money on processing. Those costs are generally passed on to the person receiving the meat."
2024-05-29 10:02:58,2024-05-29 10:22:00,IP Address,100,1141,True,2024-05-29 10:22:02,R_5CJehImmIYJs5BF,email,EN,May,29,2024,Hunters Against Hunger,Missoula,MT,Missoula,59808,Yes,Montana Food Bank Network,"Wild game meat donation program,Food bank",,Yes,,"Montana Food Bank Network ",State,Yes,"MFBN pays all processors and facilitates processor recruitment. It then pairs processors with a local food pantry to distribute donations ",2013,11,,October,2023,March,2024,,28124,Actual,0,0,0,0,0,0,0,0,0,0,0,0,0,Actual,Actual,Actual,Actual,Actual,Actual,Actual,Actual,Actual,Actual,Actual,Actual,Actual,"We only do Elk, Deer, Moose, Bison, Antelope. We separate by county rather than species when measuring program ",60,300,Estimated,Estimated,State,,,,2,2,10,,4,,,Yes,"We do processing for City Deer Culls and Shoulder season/damage hunts ",Yes,"More processors to serve a greater amount of the state would be helpful ",5,,3,,10,,,31,45,Actual,Estimated,,Yes,,45,200,1,0,150,Actual,Estimated,Actual,Estimated,Actual,,"100,000",Actual,0,0,0,0,"100,000",0,,,,,,,,No,,No,,,
2024-05-29 11:06:38,2024-05-29 11:32:29,IP Address,100,1550,True,2024-05-29 11:32:30,R_1R823F0QZRmse4h,email,EN,May,29,2024,Hunters Helping the Hungry,Lincoln,NEBRASKA,United States,68504,No,,Wild game meat donation program,"Program is run by a person within the Game and Parks Commission ",Yes,,Nebraska Game and Parks Commission,State,Yes,"A person within the agency runs the program ",2011,12,,August,2023,January,2024,,10161,Actual,010161,0,0,0,0,0,0,0,0,0,0,0,0,Actual,Actual,Actual,Actual,Actual,Actual,Actual,Actual,Actual,Actual,Actual,Actual,Actual,,,,Estimated,Estimated,State,,1,1,6,3,9,1,1,,,No,,No,,,,,,,,,7,9,Actual,Actual,Varies year to year,Yes,,0,0,1,0,,Actual,Estimated,Actual,Estimated,Actual,"One person runs the program from an admin standpoint, the processors are then responsible for transporting meat to food banks on their own. ",,,0,0,0,0,0,0,,,,,,,"Program runs on only public donations that come in throughout the year, amount varies year to year",Yes,Jordyn at (402) 471-5430,Yes,,,
2024-05-28 13:46:20,2024-05-29 12:50:13,IP Address,100,83032,True,2024-05-29 12:50:14,R_5JQmLm3u0z4P43K,email,EN,May,29,2024,Farmers and /Hunters Feeding the Hungry Coshocton county.,Coshocton,OH,United States,43812,Yes,Farmers and hunters Feeding the hungry.,Wild game meat donation program,,Yes,,FHFH,National,Yes,,15  +,,,September,2011,May,2024,,,Actual,"200,000",0,0,0,0,0,0,0,0,0,0,0,"100,000",Estimated,Actual,Actual,Actual,Actual,Actual,Actual,Actual,Actual,Actual,Actual,Actual,Estimated,Estimate from 2011 to 2024,10,20,Estimated,Estimated,Multiple counties,,,,5,,,,,,,No,,Yes,,0,5,,,2,,,3,3,Actual,Actual,,Yes,,2,200,0,00,0,Actual,Estimated,Actual,Estimated,Actual,,10000,Estimated,8000,2000,0,0,0,0,Estimated,Estimated,,,,,,Yes,,Yes,,,
2024-05-29 13:25:30,2024-05-29 13:33:54,IP Address,100,503,True,2024-05-29 13:33:55,R_54AfDL12Eb3kLt3,email,EN,May,29,2024,"Farmers &  Hunters Feeding the Hungry, Southwest Michigan Chapter",Constantine,MI,United States,49042,No,,Wild game meat donation program,,Yes,,Farmers & Hunters Feeding the Hungry,National,No,,2014,10,,September,2014,May,2024,Our efforts are year around.,60,Estimated,060,0,0,0,0,0,0,0,0,0,0,0,0,Estimated,Actual,Actual,Actual,Actual,Actual,Actual,Actual,Actual,Actual,Actual,Actual,Actual,,15,29,Estimated,Estimated,Multiple counties,St. Joseph County and Cass County Michigan,8,,9,8,9,,,,,No,,No,,,,,,,,,1,2,Actual,Actual,,No,,3,30,0,0,0,Actual,Estimated,Actual,Estimated,Actual,30 hours average per year,2200,Estimated,0500,01700,0,0,0,0,Estimated,Estimated,,,,,,No,,No,,,
2024-05-31 22:46:28,2024-05-31 23:33:53,IP Address,100,2844,True,2024-05-31 23:33:54,R_5VxwH1VrVCGCMLx,email,EN,June,1,2024,CSEA Hunters Feeding the Hungry Deer Donation,Providence,RI,"USA ",02907,No,,"Wild game meat donation program,Sportsmen, hunting, or conservation organization","Hunters donate deer, duck, and/or geese to our agency and we give it to needy families.",No,,,,,,2016,8,,October,2023,March,2024,,Unsure of what this refers to,Estimated,7600,0,0,0,0,0,0,0,0,0,0,10,0,Estimated,Actual,Actual,Actual,Actual,Actual,Actual,Actual,Actual,Actual,Actual,Estimated,Actual,"We mostly had deer donated. I guess they would be called ""white tailed deer."" I kept track of them by how many whole deers were donated. I did not keep track of the pounds. We often received whole, gutted deer.",50,70,Estimated,Estimated,State,We had many deer donated from Block Island. Most of the clients receiving the deer live in and around Providence. The ferry is how the deer got into mainland RI. So the farthest that the deer traveled is approximately 70 miles.,,,3,,,7,4,,,Yes,Rhode Island's Department of Environmental Management referred hunters to our agency. Many of the hunters kept our office number and call us every year to take the donations.,Yes,"We always have clients who are low income and in need of donations. Deer meat is something that they enjoy eating and appreciate the donations. ",,9,7,5,,,"We cannot store any meat in our office building. We need to find families to take the deer within 1 to 2 hours after getting a call to pick up the deer. ",0,0,Actual,Actual,"We give donated deer directly to needy families. We do not ""process"" the meat.",,NA,0,0,15,5,37.5,Actual,Actual,Actual,Actual,Actual,We have full time staff that do other social services programs. There were only 4 staff members who are actively involved in the deer donation work.,0,Actual,0,0,0,0,0,0,Actual,Actual,Actual,Actual,Actual,,"There is no funding for this program. We pay for mileage for staff who pick up the deer, we pay for U-haul box truck to transport the deer out of an unrestricted funding pool that we can use. ",Yes,"Kannyka Pouk, 401-274-8811",Yes,,,
2024-05-23 09:44:49,2024-06-03 06:53:32,IP Address,100,940123,True,2024-06-03 06:53:33,R_71iifNrXvZXtsnf,email,EN,May,29,2024,Share the Harvest,Columbia,Missouri,United States,65202,Yes,MISSOURI DEPARTMENT OF CONSERVATION,"Sportsmen, hunting, or conservation organization","This program is administered by the Conservation Federation of Missouri and the Missouri Department of Conservation.. Statewide sponsors of the cost-reduction program include the Conservation Department, Conservation Federation of Missouri, Feeding Missouri, Shelter Insurance, Missouri Chapter National Wild Turkey Federation, Bass Pro Shops, and Gateway Area Chapter of Safari Club International.",No,,,,,,2011,13,,September,2023,January,2024,Some of these answers are to the best of our knowledge. To be honest the program is hard to track and the communication is not great.,Unsure,Estimated,0,0,0,0,0,0,0,0,0,0,0,0,0,Actual,Actual,Actual,Actual,Actual,Actual,Actual,Actual,Actual,Actual,Actual,Actual,Actual,The program in Missouri has been impossible to track from county to county or for an overall pounds. You could reach out to the Conservation federation to see if they have a number that hey could quote.    https://mdc.mo.gov/hunting-trapping/species/deer/share-harvest,,,Estimated,Estimated,Multiple counties,"The processed deer typically stays within the county that it was processed in and then distributed directly to one of our partner agencies. 
 https://mdc.mo.gov/hunting-trapping/species/deer/share-harvest",8,3,5,7,8,3,3,,,No,very little if any communication from the State agency,Yes,The feedback that we get from hunters is about the difficulty to locate participating State or USDA inspected processors. Some hunters say that they too have to pay for the processing despite the state also paying for the processing. lots of confusion it seems,8,5,5,5,8,,,,,Estimated,Estimated,Unknown,Yes,https://mdc.mo.gov/hunting-trapping/species/deer/share-harvest,,,,,,Estimated,Estimated,Estimated,Estimated,Estimated,N / A,,,0,0,0,0,0,0,,,,,,,All 6 Food Banks in the State of Missouri pitch in funds to help pay for the program.,Yes,Daryle Bascom -  573-447-6649,No,,N/A,We would love to grow the program and would love to have better reporting structure but have not been able to move the needle with the program administrators.
2024-06-03 15:00:34,2024-06-03 15:15:22,IP Address,100,888,True,2024-06-03 15:15:23,R_5TXcIA9dTJ5Hryx,email,EN,June,3,2024,Share the Harvest,JEFFERSON CITYJ,MO,United States,65101,Yes,Conservation Federation of Missouri,"Sportsmen, hunting, or conservation organization",,Yes,,Missouri Department of Conservation,State,No,,1992,32,"In 1992, hunters in Missouri began a program to share the deer they harvested with those less fortunate. From that beginning developed a statewide system run by the Conservation Department (MDC) and the Conservation Federation of Missouri called Share The Harvest, a program that provides an easy way for hunters to donate venison to Missourians in need of red meat.

Share The Harvest is a WIN WIN WIN program. Hunters win by doing their part to help people in need, cooperating processing plants win by getting positive feedback for their involvement and donations of locker space, and participating organizations win by having a ready-made service project for a good cause. Plus, the Department of Conservation has yet another tool to use in the management of Missouri’s valuable deer resource.",September,2023,February,2024,"This captures the annual deer season including the culling period which gets meat accepted into the program. ","247,575",Actual,"247,575",0,0,0,0,0,0,0,0,0,0,0,0,Actual,Actual,Actual,Actual,Actual,Actual,Actual,Actual,Actual,Actual,Actual,Actual,Actual,,30,125,Estimated,Estimated,Local,,,,1,9,8,4,5,,,Yes,Missouri Dept of Conservation,Yes,"We always have more deer than we have processors or money. Money runs out first. ",9,1,4,4,9,,,100,60,Actual,Estimated,,No,,10,100,.5,0,240,Estimated,Estimated,Estimated,Estimated,Estimated,,"500,000",Estimated,"5,000","10,000","360,000",0,"125,000",0,Estimated,Estimated,Estimated,,Estimated,,,Yes,,Yes,,,
2024-06-03 08:23:25,2024-06-03 18:41:10,IP Address,100,37065,True,2024-06-03 18:41:12,R_6DdcZXA7QbcAK0H,email,EN,June,3,2024,Help Meat the Need,Anchorage,alaska,usa,99501,Yes,Food Bank of Alaska,Food bank,,Yes,,Feeding America,National,No,,2009,15 + years,The program for Food Bank of Alaska has been in effect longer than I have been with Food Bank of Alaska.,July,2023,June,2024,I was not sure of just how to answer these questions. This more of an ongoing program.,40,Estimated,0,0,0,0,0,0,40,0,0,0,0,0,0,Actual,Actual,Actual,Actual,Actual,Actual,Estimated,Actual,Actual,Actual,Actual,Actual,Actual,,7,7,Estimated,Estimated,Local,,,,9,,,9,,,For Food Bank of Alaska. Our biggest challenge is transportation from Harvest to processor or Food Bank.,No,,Yes,We are always open to expanding the program.,,1,,9,,,,2 to 3 processors,less than 5,Estimated,Estimated,,No,We have been working on the premise of we are the coordinators for these donations.,0,,1-2,0,3 hours a month,Actual,Estimated,Estimated,Actual,Estimated,,,,0,0,0,0,0,0,,,,,,,"I am leaving this page blank as I am not involved in this process. ",Yes,,No,,,
2024-06-04 05:30:24,2024-06-04 13:16:56,IP Address,100,27992,True,2024-06-04 13:16:57,R_7Km9uFKWRgWGyQZ,email,EN,June,3,2024,Farmers and hunters feeding the hungry Greene county Indiana,"Bloomfield ",Indiana,USA,47424,No,,Wild game meat donation program,,Yes,,Farmers and hunters feeding the hungry,National,Yes,"Insurance, accounting, reporting, promotional support, grant writing and submittal",2006,17,"Approximate ",September,2023,January,2024,,33,Actual,2074,0,0,0,0,0,0,0,0,0,0,0,0,Actual,Actual,Actual,Actual,Actual,Actual,Actual,Actual,Actual,Actual,Actual,Actual,Actual,,15,20,Estimated,Estimated,County,,8,8,2,2,,,,,,No,,No,,,,,,,,,1,5,Actual,Actual,,Yes,,1,20,0,0,0,Actual,Estimated,Actual,Estimated,Actual,"National organization has paid staff, local is volunteer.",3020,Actual,0,0,0,3000,0,0,,,,Actual,,,,Yes,8126993444,No,,Hoosiers Feeding the hungry,
